{
  "title": "June 1879 to May 1880, Arctic Exploring Expedition",
  "description": "Description of the logbook",
  "starts_at": "1879-06-25",
  "ends_at": "1880-05-30",
  "page_count": 375,
  "url": "http://shiplog-website.127.0.0.1.xip.io/ships/uss-jeannette/logbooks/june-1879-to-may-1880-arctic-exploring-expedition"
}

